<?xml version="1.0" encoding="UTF-8"?>
<!--Sample XML file generated by XML Spy v4.0 U (http://www.xmlspy.com)-->
<SemanticLookup xmlns:xsi="http://www.w3.org/2001/XMLSchema-instance" xsi:noNamespaceSchemaLocation="http://www.cs.columbia.edu/~valetto/metaparser/SemanticLookup.xsd">
	<Row>
		<Hint>schema</Hint>
		<SchemaURL>http://www.cs.columbia.edu/~valetto/metaparser/schema.xsd</SchemaURL>
		<TagProcessorURL>http://www.cs.columbia.edu/~valetto/metaparser/tagprocessor.jar</TagProcessorURL>
	</Row>
	<Row>
		<Hint>schema2</Hint>
		<SchemaURL>http://www.cs.columbia.edu/~valetto/metaparser/schema2.xsd</SchemaURL>
		<TagProcessorURL>http://www.cs.columbia.edu/~valetto/metaparser/tagprocessor.jar</TagProcessorURL>
	</Row>
	<Row>
		<Hint>schema3</Hint>
		<SchemaURL>http://www.cs.columbia.edu/~valetto/metaparser/schema.xsd</SchemaURL>
		<TagProcessorURL>http://www.cs.columbia.edu/~valetto/metaparser/tagprocessor.jar</TagProcessorURL>
	</Row>
</SemanticLookup>
